text_data,output,flag,username,timestamp
"I usually choose a clinic project based on my personal interest in the medical field and try to find one that aligns with my passion for helping others.

I rely on recommendations from friends and family who have previously participated in clinic projects. Their positive experiences guide my decision-making.

I look for clinic projects that offer opportunities for hands-on experience and skill development. Practical learning is crucial for me.

The location of the clinic project matters to me. I prefer projects that are easily accessible and won't require a lot of travel.

I pick clinic projects that focus on areas where I feel I can make a meaningful impact and contribute to the community's well-being.

Project diversity is key for me. I like to engage in a variety of clinic projects to broaden my knowledge and gain exposure to different aspects of healthcare.

I consider the duration of the clinic project. Short-term projects fit better into my schedule and allow me to balance other commitments.

I prioritize clinic projects with a strong mentorship program. Having guidance from experienced professionals enhances my learning experience.

Project outcomes and impact on the community play a significant role in my decision-making. I want to be part of projects that make a positive difference.

I take into account the technology and resources available at the clinic. Up-to-date facilities and equipment contribute to a more enriching learning environment for me.

done",Analysis completed. Check the console for details.,,,2024-02-05 18:39:48.266475
"Speaker 1: Good morning, Speaker 2. I'm curious about your role in managing clinic projects. Can you share how you go about choosing which projects to take on?

Speaker 2: Good morning! Certainly. When selecting clinic projects, I prioritize those that align with our mission and have a meaningful impact on the community. I also consider the feasibility and resources required for each project.

Speaker 1: That makes sense. How do you assess the potential impact of a clinic project on the community?

Speaker 2: We conduct thorough research to understand the community's needs and challenges. Additionally, we engage with local stakeholders and gather input to ensure our projects address relevant issues and have a positive and lasting effect.

Speaker 1: Interesting approach. How about the feasibility aspect? What factors do you take into account when determining if a project is feasible?

Speaker 2: Feasibility involves assessing the availability of resources, both financial and human, as well as the project's timeline. We also evaluate the potential challenges and risks associated with each project to ensure we can successfully execute and complete it.

Speaker 1: It sounds like a comprehensive process. Lastly, how do you involve the community in the decision-making process when selecting clinic projects?

Speaker 2: Community involvement is crucial. We organize town hall meetings, conduct surveys, and establish partnerships with local organizations to gather input. This collaborative approach ensures that our clinic projects truly meet the needs of the community we aim to serve.

Speaker 1: Thank you for sharing your insights, Speaker 2. It's clear that your approach involves a thoughtful and inclusive process for selecting clinic projects.

Speaker 2: You're welcome! It's essential to ensure our projects have a positive and lasting impact on the communities we serve.",Yerk,Dom,,,Speaker 1 Word Counts,"{""headers"":[],""data"":[[]],""metadata"":null}",Speaker 1 Description,"The text discusses the importance of mental health and the impact it can have on individuals and society. It also highlights the importance of seeking help and support when facing mental health challenges. Overall, the text emphasizes the need for understanding and destigmatizing mental health issues.",,,,"{""headers"":[""1"",""2"",""3""],""data"":[[]],""metadata"":null}",Speaker 2 Description,"The text is about the impact of social media on society. It explores how social media has changed the way people communicate, consume information, and interact with each other. It also discusses the positive and negative effects of social media on individuals and society as a whole.",,,2024-02-17 22:21:13.680126
